{
  "artifact_digest": "sha256:4cf7c5e4472e227388bb9fed5b87781bc1b8d0833dc699edce96f3116bee28ec",
  "component_count": 109,
  "format": "CycloneDX JSON",
  "generator": "Trivy",
  "generator_version": "Version: 0.72.0",
  "sbom_reference": "outputs/security/supply-chain/container-sbom.cdx.json",
  "schema_version": "1.0",
  "sha256": "e94b93e4a7bf40bb76366518361372c01de6fa0520d3c8a79dbb6625bb47ea8f",
  "spec_version": "1.7"
}
